{
  "$schema": "./documents.schema.json",
  "portraits": {
    "title": "EK-3 · Devredilen Varlıkların Resimleri",
    "note": "Her resmin altında bir numara var. Hiçbirinin altında bir ad yok."
  },
  "russian": {
    "lines": [
      { "ru": "ДОГОВОР О ПЕРЕДАЧЕ ПРАВ НА ОБЪЕКТ НЕДВИЖИМОСТИ", "tr": "(Bir gayrimenkul üzerindeki hakların devrine ilişkin sözleşme)" },
      { "ru": "Объект: комната № 14", "tr": "(Taşınmaz: 14 numaralı oda)" },
      { "ru": "Местонахождение: мир № 382", "tr": "(Konumu: 382 numaralı dünya)" },
      { "ru": "Площадь: не установлена", "tr": "(Alanı: belirlenmemiş)" }
    ]
  },
  "clause": {
    "title": "ULUSAL KRİSTAL KOMİTESİ — HAK AKTARIMI ANLAŞMASI",
    "articles": [
      "Madde 7. Devreden, içinde taşıdığı bütün ruhları, anıları ve bunlardan yetişecek her türlü meyveyi, bu anlaşma damgalandığı andan itibaren Komite’ye devreder.",
      "Madde 8. Devreden toplantıya gelmese bile devir geçerlidir."
    ],
    "signature": "Devreden: Gorti Evaskinan · İmza yeri boş bırakılmıştır."
  },
  "final": {
    "title": "SON SAYFA",
    "lines": ["Devredilen: içerideki bütün ruhlar.", "Devralan: Ulusal Kristal Komitesi."],
    "stamp": "SATILDI"
  }
}
